baker_name,baker,baker_age,baker_occupation,hometown,series,episode,signature_bake,show_stopper,technical,result
Ali Imdad,Ali,25,Charity worker,"Saltley, Birmingham",4,1,Rose and Pistachio Cake,"Chocolate, Raspberry and Passion Fruit Engagement Cake",11,IN
Ali Imdad,Ali,25,Charity worker,"Saltley, Birmingham",4,2,Italian Grissini,Sweet and Savoury Yin Yang Bread,9,IN
Ali Imdad,Ali,25,Charity worker,"Saltley, Birmingham",4,3,"Coconut, Raspberry and Lemon Meringue Trifle",Vanilla Latte Mini CakesLime & Mint Shortbread Pops,5,IN
Ali Imdad,Ali,25,Charity worker,"Saltley, Birmingham",4,4,Apple and Ginger Pie with a Pecan and Walnut Shortcrust Pastry,"Orange, Cardamom and Date M'Hanncha",8,OUT
Alice Fevronia,Alice,28,Geography teacher,Essex,10,NA,NA,NA,NA,NA
Alvin Magallanes,Alvin,37,Nurse,"Bracknell, Berkshire",6,1,Orange Vanilla and Fig Madeira Cake,Black Forest Gâteau,2,IN
Alvin Magallanes,Alvin,37,Nurse,"Bracknell, Berkshire",6,2,"Jackfruit, Pistachio and Macadamia Biscotti",Gingerbread Box filled with Brandy Snaps,6,IN
Alvin Magallanes,Alvin,37,Nurse,"Bracknell, Berkshire",6,3,"Prosciutto, Manchego and Balsamic Onion Soda Breads",Cornucopia,4,IN
Alvin Magallanes,Alvin,37,Nurse,"Bracknell, Berkshire",6,4,Blackberry Crème Brûlées,Tower of Fruits Cheesecakes,9,IN
Alvin Magallanes,Alvin,37,Nurse,"Bracknell, Berkshire",6,5,Pineapple Upside Down Cake,"Buko Pandan, Mango and Passion Fruit Ice Cream Roll",8,IN
Alvin Magallanes,Alvin,37,Nurse,"Bracknell, Berkshire",6,6,Plum Frangipane Tart,Smoked Salmon En Croûte and Vermouth Chicken à la King Vol-au-vents,6,OUT
Amelia LeBruin,Amelia,24,Fashion designer,Halifax,10,NA,NA,NA,NA,NA
Andrew Smyth,Andrew,25,Aerospace engineer,"Derby / Holywood, County Down",7,1,Lemon and Rosemary Drizzle Cake,'Ultimate Indulgence' Mirror Glaze Cake,12,IN
Andrew Smyth,Andrew,25,Aerospace engineer,"Derby / Holywood, County Down",7,2,Beehive Biscuits,Punting in Cambridge,4,IN
Andrew Smyth,Andrew,25,Aerospace engineer,"Derby / Holywood, County Down",7,3,Chocolate Barmbrack Bread,Braided Harvest Bread Basket,2,IN
Andrew Smyth,Andrew,25,Aerospace engineer,"Derby / Holywood, County Down",7,4,Yorkshire 'Tapas' Puddings,Churros Window Box,4,IN
Andrew Smyth,Andrew,25,Aerospace engineer,"Derby / Holywood, County Down",7,5,Mum and Dad's Breakfast Pastries,Spicy Chorizo Squash Parcels and Baklava Bites,6,IN
Andrew Smyth,Andrew,25,Aerospace engineer,"Derby / Holywood, County Down",7,6,Tangy Lime and Ginger Meringue Pie,Spring Elderflower Trio,6,IN
Andrew Smyth,Andrew,25,Aerospace engineer,"Derby / Holywood, County Down",7,7,Tropical Holiday Roulade,Childhood Ice Cream Mousse Cakes,1,STAR BAKER
Andrew Smyth,Andrew,25,Aerospace engineer,"Derby / Holywood, County Down",7,8,Da Vinci Inspired Geared Pies,Jousting Knights Marchpane,2,IN
Andrew Smyth,Andrew,25,Aerospace engineer,"Derby / Holywood, County Down",7,9,Cheesy Elephant Ears and Herby Treble Clefs,Philharmonic Fondants,2,STAR BAKER
Andrew Smyth,Andrew,25,Aerospace engineer,"Derby / Holywood, County Down",7,10,Crunchy Caramel Cassis Crown,Family and Friends' Favourites Picnic,1,Runner-up
Annetha Mills,Annetha,30,Midwife,Essex,1,1,Light Jamaican Black Cakewith Strawberries and Cream,"Red, White & Blue Chocolate Cake with Cigarellos, Fresh Fruit, and Cream",2,IN
Annetha Mills,Annetha,30,Midwife,Essex,1,2,Rose Petal Shortbread,Pink Swirl Macarons / Eclairs,7,OUT
Antony Amourdoux,Antony,30,Banker,London,9,NA,NA,NA,NA,NA
Beca Lyne-Pirkis,Beca,31,Military Wives' Choir Singer,"Aldershot, Hampshire",4,1,Grapefruit Sandwich Cake,Chocolate Cherry Indulgence,8,IN
Beca Lyne-Pirkis,Beca,31,Military Wives' Choir Singer,"Aldershot, Hampshire",4,2,Fennel and Chilli Breadsticks,Five Strand Christmas Wreath,11,IN
Beca Lyne-Pirkis,Beca,31,Military Wives' Choir Singer,"Aldershot, Hampshire",4,3,Orange and Ginger Trifle,Limoncello and Blueberry BurstsMillionaire Shortbread,10,IN
Beca Lyne-Pirkis,Beca,31,Military Wives' Choir Singer,"Aldershot, Hampshire",4,4,Mamgu's Cherry-Apple Tart,Moroccan Vegetable Filo Feast,2,IN
Beca Lyne-Pirkis,Beca,31,Military Wives' Choir Singer,"Aldershot, Hampshire",4,5,"Chocolate, Cherry and Hazelnut Brownies",Tiered Macaron and Sugar Dough Biscuit Centrepiece,5,IN
Beca Lyne-Pirkis,Beca,31,Military Wives' Choir Singer,"Aldershot, Hampshire",4,6,Bara Brith,Chocolate and Rum-Soaked Prune BriochesCardamom Spiced Lemon Iced Buns,6,IN
Beca Lyne-Pirkis,Beca,31,Military Wives' Choir Singer,"Aldershot, Hampshire",4,7,Spring Lamb and Vegetable Suet Puddingwith Redcurrant Gravy,Nectarine and Frangipane SquaresChocolate and Hazelnut Vol-au-ventsStrawberries and Cream Mille-feuille,1,IN
Beca Lyne-Pirkis,Beca,31,Military Wives' Choir Singer,"Aldershot, Hampshire",4,8,"Potato, Spelt and Rosemary Focaccia",Spiced Butternut Squash and Pecan 'Cheese' Cake,4,IN
Beca Lyne-Pirkis,Beca,31,Military Wives' Choir Singer,"Aldershot, Hampshire",4,9,Stilton and Walnut MacaronsBeetroot and Salmon Choux PuffsWelsh Rarebit Tartlets,Banoffee Opera Cake,3,OUT
Ben Frazer,Ben,31,Graphic Designer,Northampton,2,1,Rhubarb and Custard CupcakesAfter Dinner Cupcakes,Vanilla Sponge with White Chocolate and Raspberry Buttercream,2,IN
Ben Frazer,Ben,31,Graphic Designer,Northampton,2,2,"Chorizo, Pepper and Gruyere Quiche",Lemon Meringue Tarts,1,IN
Ben Frazer,Ben,31,Graphic Designer,Northampton,2,3,"Walnut, Raisin and Rosemary Loaf",UNKNOWN,3,IN
Ben Frazer,Ben,31,Graphic Designer,Northampton,2,4,Stem Ginger Nuts,Chocolate and Almond MacaronsPine Nut MacaronsPistachio Macarons,5,OUT
Benjamina Ebuehi,Benjamina,23,Teaching assistant,South London,7,1,"Pistachio, Cardamom and Lemon Drizzle Cake",White Chocolate Mirror Glaze with Salted Praline Buttercream,6,IN
Benjamina Ebuehi,Benjamina,23,Teaching assistant,South London,7,2,Bouquet Biscuits,"New York, New York",3,IN
Benjamina Ebuehi,Benjamina,23,Teaching assistant,South London,7,3,"Chocolate, Tahini and Almond Babka",Braided Bread Heart,6,IN
Benjamina Ebuehi,Benjamina,23,Teaching assistant,South London,7,4,"Red Onion Chutney, Brie and Bacon Yorkshire Puddings",Tropical Churros,1,STAR BAKER
Benjamina Ebuehi,Benjamina,23,Teaching assistant,South London,7,5,'Good Morning America' Swirls and Peanut Butter and Banana Pinwheels,Plantain and Spinach Samosas and Chai Pear Cups,5,IN
Benjamina Ebuehi,Benjamina,23,Teaching assistant,South London,7,6,Grapefruit and Ginger Meringue Pie,Floral Tea Cake,2,IN
Benjamina Ebuehi,Benjamina,23,Teaching assistant,South London,7,7,Piña Colada Roulade,Apple Crumble Mousse Cake and Chocolate Coffee Mousse Cake,3,IN
Benjamina Ebuehi,Benjamina,23,Teaching assistant,South London,7,8,Mexican Adventure,Tudor Garden,4,OUT
Brendan Lynch,Brendan,63,Recruitment consultant,Sutton Coldfield,3,1,"Plum, Sour Cherry & Walnut",UNKNOWN,10,IN
Brendan Lynch,Brendan,63,Recruitment consultant,Sutton Coldfield,3,2,Middle Eastern Taboon BreadIndian Rotis,"Chocolate and Vanilla Bagels
Cumin and Gruyere Bagels",4,IN
Brendan Lynch,Brendan,63,Recruitment consultant,Sutton Coldfield,3,3,Apple and Ginger Tarte Tatin,"Blackberry, Nectarine and Dragon Fruit Tart",9,IN
Brendan Lynch,Brendan,63,Recruitment consultant,Sutton Coldfield,3,4,Clementine and Chestnut Torte,"Pear, Chocolate and Hazelnut Dacquoise",1,STAR BAKER
Brendan Lynch,Brendan,63,Recruitment consultant,Sutton Coldfield,3,5,Salmon Coulibiac in a Scandinavian Pastry,All American Chiffon Pie,3,IN
Brendan Lynch,Brendan,63,Recruitment consultant,Sutton Coldfield,3,6,"Rhubarb, Strawberry and Ginger Puddings
Sticky Toffee Puddings","Spinach, Cheese and Walnut Strudel",1,STAR BAKER
Brendan Lynch,Brendan,63,Recruitment consultant,Sutton Coldfield,3,7,Chelsea Bunskis,Black Forest Christmas Stollen,4,IN
Brendan Lynch,Brendan,63,Recruitment consultant,Sutton Coldfield,3,8,Multi-Seed Savoury Crackers,Fantasy Gingerbread Bird House,2,IN
Brendan Lynch,Brendan,63,Recruitment consultant,Sutton Coldfield,3,9,Coffee Meringue and Hazelnut CreamsApricot and Pistachio FriandsLime Curd Choux Pastry Cygnets,Gateau St. Honoré,3,IN
Brendan Lynch,Brendan,63,Recruitment consultant,Sutton Coldfield,3,10,Potato and Pepper Pithivier,Family Reunion Chiffon Cake,2,Runner-up
Briony Williams,Briony,33,Full-time parent,Bristol,9,NA,NA,NA,NA,NA
Candice Brown,Candice,31,PE teacher,"Barton-Le-Clay, Bedfordshire",7,1,Raspberry and Rhubarb Drizzle Custard Bundt Cake,"Mirror Mirror On The Wall, Who Is The Shiniest Cake Of Them All?",5,IN
Candice Brown,Candice,31,PE teacher,"Barton-Le-Clay, Bedfordshire",7,2,"Salted Caramel, Chocolate Iced Shiny Hearts",Gingerbread Pub with Sticky Ginger Carpet,8,STAR BAKER
Candice Brown,Candice,31,PE teacher,"Barton-Le-Clay, Bedfordshire",7,3,"Chocolate, Salted Caramel & Pecan Brittle Brioche Loaf",Italian Light and Dark Rye Twist,3,IN
Candice Brown,Candice,31,PE teacher,"Barton-Le-Clay, Bedfordshire",7,4,Yorkshire Wellingtons,Two-Way Peanut Butter Churros,2,IN
Candice Brown,Candice,31,PE teacher,"Barton-Le-Clay, Bedfordshire",7,5,"Danish Pastry Croque Monsieur Kites and Cinnamon Apple, Vanilla Crème Rose Danish","Sausage, Black Pudding and Apple Rounds and Banoffee Whiskey Cups",2,STAR BAKER
Candice Brown,Candice,31,PE teacher,"Barton-Le-Clay, Bedfordshire",7,6,"Lime, Coconut and Lemongrass Sugar Meringue Pie",Four Seasons Cake,5,IN
Candice Brown,Candice,31,PE teacher,"Barton-Le-Clay, Bedfordshire",7,7,Crowd Pleaser Roulade,Blackberry and Raspberry Bubbles and After Dinner Mousse,2,IN
Candice Brown,Candice,31,PE teacher,"Barton-Le-Clay, Bedfordshire",7,8,Cheesy Cheeky Fish Pies,Peacock,1,STAR BAKER
Candice Brown,Candice,31,PE teacher,"Barton-Le-Clay, Bedfordshire",7,9,"Red Onion, Cambozola and Walnut Palmiers and Mushroom, Streaky Bacon, and Parmesan Palmiers",Chocolate Praline Fondant Fancies and Cherry Bakewell Fondant Fancies,3,IN
Candice Brown,Candice,31,PE teacher,"Barton-Le-Clay, Bedfordshire",7,10,Queen Victoria's Mango and Strawberry Crown,Picnic for Pearly Kings and Queens,2,WINNER
Cathryn Dresser,Cathryn,27,Shop assistant,"Pease Pottage, West Sussex",3,1,"Apple, Hazelnut and Calvados",Hidden Cupcake Cake,5,IN
Cathryn Dresser,Cathryn,27,Shop assistant,"Pease Pottage, West Sussex",3,2,"Spiced Mango NaanLime, Coriander and Chilli Tortillas","Cranberry and Orange Bagels
Chipotle, Chili, and Smoked Cheddar Bagels",8,IN
Cathryn Dresser,Cathryn,27,Shop assistant,"Pease Pottage, West Sussex",3,3,"Plum, Cherry and Five Spice Tarte Tatin","Raspberry, Pistachio and Lemon Tart",3,IN
Cathryn Dresser,Cathryn,27,Shop assistant,"Pease Pottage, West Sussex",3,4,"White Chocolate, Macadamia and Coffee Torte","Gooseberry, Almond and Honey Meringue",3,IN
Cathryn Dresser,Cathryn,27,Shop assistant,"Pease Pottage, West Sussex",3,5,Full English Wellington,Chocolate and Peanut Butter Pumpkin Pie,1,IN
Cathryn Dresser,Cathryn,27,Shop assistant,"Pease Pottage, West Sussex",3,6,"Chocolate Walnut Whip Puddings
Elderflower Sponges",Roasted Vegetable Couscous and Sheep Cheese Strudel,3,IN
Cathryn Dresser,Cathryn,27,Shop assistant,"Pease Pottage, West Sussex",3,7,Lady Arundel's Manchet Buns,Bonfire Night Tear 'n' Share Brioche,5,IN
Cathryn Dresser,Cathryn,27,Shop assistant,"Pease Pottage, West Sussex",3,8,Cheese and Pickle Crackers,Gingerbread Buckingham Palace,5,OUT
Chetna Makan,Chetna,35,Fashion Designer,"Broadstairs, Kent",5,1,"Cardamom, Pistachio and Coffee Swiss Roll",Tiered Victoria Sponges with Lemon Curd and Raspberry Cream,3,IN
Chetna Makan,Chetna,35,Fashion Designer,"Broadstairs, Kent",5,2,Fenugreek and Carom Crackers,Day On The Beach,8,IN
Chetna Makan,Chetna,35,Fashion Designer,"Broadstairs, Kent",5,3,Onion and Pine Nut Rolls,Rolled and Filled Twin Loaf,8,IN
Chetna Makan,Chetna,35,Fashion Designer,"Broadstairs, Kent",5,4,"Rhubarb, Strawberry and Orange Puddings","Mango, Raspberry and Coconut Baked Alaska",3,IN
Chetna Makan,Chetna,35,Fashion Designer,"Broadstairs, Kent",5,5,Rice Custard Tart with Mangoes and Raspberries,Fusion Tiered Pies,2,IN
Chetna Makan,Chetna,35,Fashion Designer,"Broadstairs, Kent",5,6,Orange Savarin with Cinnamon Cream,Almond Liqueur Dobos Torte with Chocolate Caramel Buttercream,2,STAR BAKER
Chetna Makan,Chetna,35,Fashion Designer,"Broadstairs, Kent",5,7,Crispy Lentil Kachori,Chocolate and Mango & Lemon Meringue Éclairs,6,IN
Chetna Makan,Chetna,35,Fashion Designer,"Broadstairs, Kent",5,8,Date and Walnut Swirl Bread,Chocolate Mousse Filled DoughnutsBraided Doughnuts,1,IN
Chetna Makan,Chetna,35,Fashion Designer,"Broadstairs, Kent",5,9,Chocolate Orange Baklava Masala Chai Baklava,"Chocolate, Orange & Nut EntremetsCappuccino Entremets",4,OUT
Chris Geiger,Chris,50,Software developer,Bristol,8,1,Tropical Fresh Fruit Cake,'Raised Pork Pie and Egg Surprise' Cake,12,IN
Chris Geiger,Chris,50,Software developer,Bristol,8,2,Chocolate Chia Seed Biscuits with Whisky Caramel Filling,'The Great British Sail Off' Game,11,OUT
Christine Wallace,Christine,66,Director of an engraving company,"Didcot, Oxfordshire",4,1,"Strawberry, Vanilla and Rosewater Summer Basket",Chocolate and Orange 'Fripperous' Hat Cake,3,IN
Christine Wallace,Christine,66,Director of an engraving company,"Didcot, Oxfordshire",4,2,Mediterranean Breadsticks with Oregano,Double Plaited Loaf,4,IN
Christine Wallace,Christine,66,Director of an engraving company,"Didcot, Oxfordshire",4,3,Caribbean Pina Colada Trifle,Ninety-NinersSachertorte Parcels,4,STAR BAKER
Christine Wallace,Christine,66,Director of an engraving company,"Didcot, Oxfordshire",4,4,"Granny Rogers' Apple, Plum & Cinnamon Country Pie",Roasted Vegetable Filo Pie with Feta Cheese,7,IN
Christine Wallace,Christine,66,Director of an engraving company,"Didcot, Oxfordshire",4,5,Mixed Berry and Almond Crumble Traybake,Shortbread Bavarian Clock Tower,1,STAR BAKER
Christine Wallace,Christine,66,Director of an engraving company,"Didcot, Oxfordshire",4,6,Oxford Nutty Fruit Loaf,Schnecken BunsVanilla Custard Skolebrød,4,IN
Christine Wallace,Christine,66,Director of an engraving company,"Didcot, Oxfordshire",4,7,Spotted Dick 'With a Kick'and Vanilla Custard Ice Cream,Eccles CakesFresh Fruit BasketsLemon Cream Eton Mess Mille-feuille,6,IN
Christine Wallace,Christine,66,Director of an engraving company,"Didcot, Oxfordshire",4,8,"Multi-Seeded Loaf with Pumpkin, Sesame and Sunflower Seeds",Sweet Potato Guitar with Passion Fruit Icing and Marshmallow Fondant,5,OUT
Yan Tsou,Yan,46,Laboratory research scientist,North London,8,1,Windfall Apple Crumble Cake,'Banana-ramen' Cake,4,IN
Yan Tsou,Yan,46,Laboratory research scientist,North London,8,2,'Mrs. Marian's PB 'n' B' Biscuits,'Adventures in Bakeland' Game,1,IN
Yan Tsou,Yan,46,Laboratory research scientist,North London,8,3,'Mrs P's' Masala Chai Spiced Teacakes,'Basil the Vegetarian Dragon with his Pumpkin Hoard' Bread Sculpture,8,IN
Yan Tsou,Yan,46,Laboratory research scientist,North London,8,4,'Lil' Red's Ginger and Nuts' Millionaire Shortbreads,Animals of the Rainforest Caramel Cake,8,IN
Yan Tsou,Yan,46,Laboratory research scientist,North London,8,5,Mango Fruit Hat Steamed School Pudding,'Heart of a Hero' Trifle Terrine,6,IN
Yan Tsou,Yan,46,Laboratory research scientist,North London,8,6,'πr2' Decorative Pies,Chequerboard Pie,1,IN
Yan Tsou,Yan,46,Laboratory research scientist,North London,8,7,Cannoli Cocktails,Canadian-Style Sfogliatelle,5,OUT
Claire Goodwin,Claire,31,Speech Therapist,"Ashton upon Mersey, Trafford",5,1,Chocolatey Orangey Swirly Roll,Mini Chocolate and Cherry Cakes,8,OUT
Dan Beasley-Harling,Dan,36,Full-time parent,London,9,NA,NA,NA,NA,NA
Dan Chambers,Dan,32,Support worker,Rotherham,10,NA,NA,NA,NA,NA
Danny Bryden,Danny,45,Intensive care consultant,Sheffield,3,1,"Plum, Ginger & Orange",UNKNOWN,7,IN
Danny Bryden,Danny,45,Intensive care consultant,Sheffield,3,2,Lime Coriander and Coconut TortillasZaatar Naan with Dukkah,UNKNOWN,3,IN
Danny Bryden,Danny,45,Intensive care consultant,Sheffield,3,3,Savoury Pear and Roquefort Tarte Tatin,"Pineapple, Coconut and Frangipane Tart",2,IN
Danny Bryden,Danny,45,Intensive care consultant,Sheffield,3,4,"Blackberry, White Chocolate, Lemon and Elderflower Torte","'Monte Bianco' Chestnut, Chocolate and Coffee Dacquoise",2,IN
Danny Bryden,Danny,45,Intensive care consultant,Sheffield,3,5,"Chickpea, Spinach & Mushroom Wellington",Trick or Treat Pumpkin Pie,7,IN
Danny Bryden,Danny,45,Intensive care consultant,Sheffield,3,6,Banoffee Puddings with Walnut Butterscotch SauceJubilee Chocolate Fondants,"Leek, Potato, Pistachio and Gruyère Strudel",2,IN
Danny Bryden,Danny,45,Intensive care consultant,Sheffield,3,7,Bakewell Chelsea Buns,European Christmas Wreath,2,STAR BAKER
Danny Bryden,Danny,45,Intensive care consultant,Sheffield,3,8,Spiced Almond Drinks Crackers,Gingerbread Big Ben,4,IN
Danny Bryden,Danny,45,Intensive care consultant,Sheffield,3,9,Blackberry and Peppermint MacaroonsMiniature Raspberry and Basil FinanciersOrange and White Chocolate Langues de Chat,Rosewater and Lychee St. Honoré,4,OUT
David Atherton,David,36,International health adviser,Whitby,10,NA,NA,NA,NA,NA
David Chambers,David,31,Entrepreneur,Milton Keynes,1,1,Chocolate Orange Cake,"Black Forest Floor Gateauxwith Moulded Chocolate Leaves, Fallen Fruitand Chocolate Mushrooms Moulded from eggs",3,IN
David Chambers,David,31,Entrepreneur,Milton Keynes,1,2,Cheddar Cheese and Fresh Rosemary Biscuits,Choux Pastry Swans  Chocolate Profiteroles,8,IN
David Chambers,David,31,Entrepreneur,Milton Keynes,1,3,Chilli Bread,"Walnut and Seed Roll
Red Berry and Almond Bun",4,IN
David Chambers,David,31,Entrepreneur,Milton Keynes,1,4,Pear and Walnut Pudding,"Apple and Blackberry Crumble, Rhubarb and Orange Betty, Suet Pear",5,OUT
Deborah Manger,Deborah,51,Dentist,Peterborough,4,1,Pineapple Cake,'Coffee Time',9,IN
Deborah Manger,Deborah,51,Dentist,Peterborough,4,2,Fennel & Chilli Breadsticks,Walnut Fleur Loaf,8,IN
Deborah Manger,Deborah,51,Dentist,Peterborough,4,3,Tropical Trifle*,Canelé Cherry and Chocolate CakesRose Cookies,9,OUT
Diana Beard,Diana,69,Women's Institute (WI) Judge,"Alkington, Shropshire",5,1,Mum's Sunday Tea Lemon Curd Swiss Roll,Chocolate Ganache Surprises,5,IN
Diana Beard,Diana,69,Women's Institute (WI) Judge,"Alkington, Shropshire",5,2,Parmesan Triangles,"Express, First Class",7,IN
Diana Beard,Diana,69,Women's Institute (WI) Judge,"Alkington, Shropshire",5,3,Rustic Picnic Rolls,Sharing Savoury Pinwheel,7,IN
Diana Beard,Diana,69,Women's Institute (WI) Judge,"Alkington, Shropshire",5,4,Orange and Lemon Curd Pots,Raspberry Ripple Alaska Swan,9,IN
Dorret Conway,Dorret,53,Accountant,"Penwortham, Lancashire",6,1,Madeira Cake with Candied Lemons,Enchanted Forest Gâteau,5,IN
Dorret Conway,Dorret,53,Accountant,"Penwortham, Lancashire",6,2,Almond and Apricot Biscotti with Amber Sugar Crystals,Box of Frogs,1,IN
Dorret Conway,Dorret,53,Accountant,"Penwortham, Lancashire",6,3,Walnut and Stilton Soda Breads,Unmade Bread,6,OUT
Edd Kimber,Edd,24,Debt collector for Yorkshire Bank,Bradford,1,1,Caramel Cinnamon and Banana Cake,N/A,1,IN
Edd Kimber,Edd,24,Debt collector for Yorkshire Bank,Bradford,1,2,Oatmeal Raisin Cookie,Pink Macarons,6,IN
Edd Kimber,Edd,24,Debt collector for Yorkshire Bank,Bradford,1,3,Olive Bread,Tomato and Mozzarella,1,IN
Edd Kimber,Edd,24,Debt collector for Yorkshire Bank,Bradford,1,4,Apple and Plum Pudding,"Apple and Cinnamon Crumble, Nutella Banana Brioche Bread Pudding, Rhubarb and Strawberry Suet Layer",3,IN
Edd Kimber,Edd,24,Debt collector for Yorkshire Bank,Bradford,1,5,"Chicken, Ham, Leek and Tarragon Pie","Almond Sweet Pastry with Ginger and Chocolate  Raspberry Tart / Yorkshire Curd Tart  Chickpea and Salami, Red and Yellow Pepper, Asparagus Gruyere Quiche Canapés",2,IN
Edd Kimber,Edd,24,Debt collector for Yorkshire Bank,Bradford,1,6,Cinnamon and Banana Cake,NA,NA,WINNER
Enwezor Nzegwu,Enwezor,39,Business Consultant,"Portsmouth, Hampshire",5,1,Raspberry and Lemon Swiss Roll,Coffee and Walnut Battenberg Squares,9,IN
Enwezor Nzegwu,Enwezor,39,Business Consultant,"Portsmouth, Hampshire",5,2,Pumpkin and Sunflower Savoury Biscuits,Space Adventure Moon Scene,9,OUT
Flo Atkins,Flo,71,Retired,Merseyside,8,1,Citrus Layer Cake,'One in a Melon' Cake,9,IN
Flo Atkins,Flo,71,Retired,Merseyside,8,2,Gin Jam Butties,'Pick My Bones' Game,10,IN
Flo Atkins,Flo,71,Retired,Merseyside,8,3,Cinnamon and Orange Teacakes,'Davy Jones' Locker' Bread Sculpture,7,OUT
Flora Shedden,Flora,19,Art gallery assistant,"Dunkeld, Perth and Kinross",6,1,Blood Orange Madeira Cake,Black Forest Gâteau,6,IN
Flora Shedden,Flora,19,Art gallery assistant,"Dunkeld, Perth and Kinross",6,2,Wedding Biscotti,Honey and Earl Grey Tea Box,2,IN
Flora Shedden,Flora,19,Art gallery assistant,"Dunkeld, Perth and Kinross",6,3,Fig and Hazelnut Rye Breads,Herb Couture,2,IN
Flora Shedden,Flora,19,Art gallery assistant,"Dunkeld, Perth and Kinross",6,4,Rhubarb and Ginger Crème Brûlées,Elderflower and Granola Cheesecakes,3,IN
Flora Shedden,Flora,19,Art gallery assistant,"Dunkeld, Perth and Kinross",6,5,"Pistachio, Apple and Cardamom Madeleine Cake",Chocolate and Pear Bûche,3,IN
Flora Shedden,Flora,19,Art gallery assistant,"Dunkeld, Perth and Kinross",6,6,Apricot and Rosemary Frangipane Tart,Asparagus and Parma Ham and Praline and Chocolate Vol-au-vents,2,IN
Flora Shedden,Flora,19,Art gallery assistant,"Dunkeld, Perth and Kinross",6,7,Game Pie with Shallot and Apple Chutney,"Raspberry, Pomegranate and Champagne Charlotte Russe",4,IN
Flora Shedden,Flora,19,Art gallery assistant,"Dunkeld, Perth and Kinross",6,8,Peach & Lemon Thyme and Smoked Almond & Butterscotch Cream Horns,Lime & Basil and Coconut & White Chocolate Religieuse à l'ancienne,3,IN
Flora Shedden,Flora,19,Art gallery assistant,"Dunkeld, Perth and Kinross",6,9,Passion Fruit and Chocolate Tart,Cocoa Carousel,1,OUT
Frances Quinn,Frances,31,Children's Clothes Designer,"Market Harborough, Leicestershire",4,1,Giant Jam Sandwich,Secret Squirrel Cake,7,IN
Frances Quinn,Frances,31,Children's Clothes Designer,"Market Harborough, Leicestershire",4,2,Giant Matchsticks,Sailor's Knot,2,IN
Frances Quinn,Frances,31,Children's Clothes Designer,"Market Harborough, Leicestershire",4,3,Apple and Blackberry Crumble Trifle,'Ballet Bites' Ginger NutcrackersSugar Plum Fairy Cakes,8,IN
Frances Quinn,Frances,31,Children's Clothes Designer,"Market Harborough, Leicestershire",4,4,Peach Pie In the Sky,Cherry Tree Baklava Filo Pie,1,IN
Frances Quinn,Frances,31,Children's Clothes Designer,"Market Harborough, Leicestershire",4,5,Millionaire Banoffee Bonus,Biscuit Buttons and Beads,3,IN
Frances Quinn,Frances,31,Children's Clothes Designer,"Market Harborough, Leicestershire",4,6,Chai Tea Loaf,Hot Cross BriochesRhubarb and Custard Kolaches,2,IN
Frances Quinn,Frances,31,Children's Clothes Designer,"Market Harborough, Leicestershire",4,7,Figgy Roll-y Poly Puddingwith Caramelised Walnut and Honey Ice-Cream,French Framboise Cream HornsSheet Music Mille-feuilleBass Clef Palmiers,5,STAR BAKER
Frances Quinn,Frances,31,Children's Clothes Designer,"Market Harborough, Leicestershire",4,8,'Chelsea Flour Show' Bun Bouquet,"Hidden Carrot Cake (Ground Praline, Beetroot and Walnut)",3,IN
Frances Quinn,Frances,31,Children's Clothes Designer,"Market Harborough, Leicestershire",4,9,"Legume Canapés:
Chantenay CarrotsChoux Pastry TomatoesCauliflower Cheese Scones",Great British Soap Opera Cake,2,IN
Frances Quinn,Frances,31,Children's Clothes Designer,"Market Harborough, Leicestershire",4,10,Rainbow Picnic Pie,Midsummer Night's Dream Wedding Cake,3,WINNER
Glenn Cosby,Glenn,37,English Teacher,"Teignmouth, Devon",4,1,Strawberries and Cream Cake,Almond and Espresso Chocolate Cake,4,IN
Glenn Cosby,Glenn,37,English Teacher,"Teignmouth, Devon",4,2,Rosemary and Parmesan Grissini,Harvest Crown,7,IN
Glenn Cosby,Glenn,37,English Teacher,"Teignmouth, Devon",4,3,Raspberry and Almond Trifle,Billionaire BouchéesOrange Financiers,1,IN
Glenn Cosby,Glenn,37,English Teacher,"Teignmouth, Devon",4,4,Apple & Maple Syrup Pie,Spanakopita (Walnut and Feta Cheese),9,IN
Glenn Cosby,Glenn,37,English Teacher,"Teignmouth, Devon",4,5,Apricot and Pistachio Tiffin,Shortbread and Macaron Helter-Skelter,2,IN
Glenn Cosby,Glenn,37,English Teacher,"Teignmouth, Devon",4,6,Devonshire Panettone,Almond and Apricot BriochesSticky Caramel Kanelbullen,5,IN
Glenn Cosby,Glenn,37,English Teacher,"Teignmouth, Devon",4,7,Prune and Armagnac Puddingwith Boozy Butterscotch Sauce,Caramelised Apple and Marzipan TartletsChocolate Elephant EarsPassion Fruit Mille-feuille,3,OUT
Helena Garcia,Helena,40,Online project manager,Leeds,10,NA,NA,NA,NA,NA
Henry Bird,Henry,20,Student,Durham,10,NA,NA,NA,NA,NA
Holly Bell,Holly,31,Advertising executive,Leicester,2,1,Cherry Bakewell Inspired CupcakesGinger Cupcakes with Fig Truffle,UNKNOWN,1,STAR BAKER
Holly Bell,Holly,31,Advertising executive,Leicester,2,2,Pesto Quiche,Milk Chocolate and Pistachio TartsTrifle Tarts,4,IN
Holly Bell,Holly,31,Advertising executive,Leicester,2,3,Picnic Loaf,Stilton and Walnut Rolls,6,IN
Holly Bell,Holly,31,Advertising executive,Leicester,2,4,Strawberry and Custard Melts,"'Chocolate bars of my youth'
(Caramel Macarons, Mint Chocolate Macarons and Chocolate Orange Macarons)",3,STAR BAKER
Holly Bell,Holly,31,Advertising executive,Leicester,2,5,"Stilton, Potato and Caramelised Onion Pie",Lime Meringue Pie,4,IN
Holly Bell,Holly,31,Advertising executive,Leicester,2,6,Father Christmas' Baked Cheesecake,Hansel and Gretel's Croquembouche,3,IN
Holly Bell,Holly,31,Advertising executive,Leicester,2,7,"White Chocolate, Hazelnut and Raspberry Genoise Mousse Cake","Apricot, Macadamia and White Chocolate PinwheelsAlmond CroissantsApple, Raisin and Cinnamon Plaits",1,IN
Holly Bell,Holly,31,Advertising executive,Leicester,2,8,Banoffee Inspired Mille Feuille,Strawberry and Cream Meringue NestGooseberry and Elderflower 'Bakewell' TartsNeapolitan Ice-Cream Sandwich,2,Runner-up
Howard Middleton,Howard,51,Council Worker,Sheffield,4,1,Passion Fruit and Coconut Cake,Black Forest Revisited,6,IN
Howard Middleton,Howard,51,Council Worker,Sheffield,4,2,Moroccan Breadsticks,Picasso Sun Bread,10,IN
